term_id,slug,name,term_group
1,uncategorized,Uncategorized,0
2,menu-1,Menu 1,0
3,รีวิวคาสิโนออนไลน์,รีวิวคาสิโนออนไลน์,0
4,โบนัสคาสิโน,โบนัสคาสิโน,0
5,สล็อตออนไลน์,สล็อตออนไลน์,0
6,โป๊กเกอร์ออนไลน์,โป๊กเกอร์ออนไลน์,0
7,เครดิตฟรี,เครดิตฟรี,0
8,รีวิวคาสิโนออนไลน์,รีวิวคาสิโนออนไลน์,0
9,w88,w88,0
10,สมัคร-letou,สมัคร letou,0
11,ทางเข้า-letou,ทางเข้า letou,0
12,ฟรีสปิน,ฟรีสปิน,0
13,เครดิตฟรี,เครดิตฟรี,0
14,สล็อตออนไลน์,สล็อตออนไลน์,0
15,แทงบอลออนไลน์ฟรี,แทงบอลออนไลน์ฟรี,0
16,letou,letou,0
17,nowbet,nowbet,0
18,พนันไก่ชน,พนันไก่ชน,0
19,ฟรีเครดิต,ฟรีเครดิต,0
20,ไก่ชน,ไก่ชน,0
21,huc99,huc99,0
22,ทางเข้า-huc99,ทางเข้า huc99,0
23,เครดิตฟรี-100-บาท,เครดิตฟรี 100 บาท,0
24,เครดิตฟรีไม่ต้องฝาก,เครดิตฟรีไม่ต้องฝาก,0
25,สมัครฟรี100,สมัครฟรี100,0
26,คาสิโน2020,คาสิโน2020,0
27,คาสิโน-เครดิตฟรี,คาสิโน เครดิตฟรี,0
28,ฟรี-100-ไม่ต้องฝาก,ฟรี 100 ไม่ต้องฝาก,0
29,สล็อต,สล็อต,0
30,ยิงปลาออนไลน์,ยิงปลาออนไลน์,0
31,เกมยิงปลา,เกมยิงปลา,0
32,เกมตกปลา,เกมตกปลา,0
33,ป๊อกเด้ง,ป๊อกเด้ง,0
34,เสือมังกร-2020,เสือมังกร 2020,0
35,รูเร็ตออนไลน์,รูเร็ตออนไลน์,0
36,ซิบโบ้ออนไลน์,ซิบโบ้ออนไลน์,0
37,แทงบาคาร่า,แทงบาคาร่า,0
38,บาคาร่าสด2020,บาคาร่าสด2020,0
39,บาคาร่าออนไลน์-เครดิตฟร,บาคาร่าออนไลน์ เครดิตฟรี,0
40,w88-ดีไหม,w88 ดีไหม,0
41,ทางเข้า-w88,ทางเข้า w88,0
42,สมัคร-w88,สมัคร w88,0
43,entaplay,Entaplay,0
44,โบนัสคืนเงินสด,โบนัสคืนเงินสด,0
45,โบนัสสมาชิกใหม่-entaplay,โบนัสสมาชิกใหม่ Entaplay,0
46,เงินฟรีสามารถเล่นคาสิโ,เงินฟรีสามารถเล่นคาสิโน,0
47,live-casino-house,live casino house,0
48,ทางเข้า-live-casino-house,ทางเข้า live casino house,0
49,สมัครสมาชิกเว็บคาสิโน,สมัครสมาชิกเว็บคาสิโน,0
50,live-casino-house-ดีไหม,live casino house ดีไหม?,0
51,สมัคร-live-casino,สมัคร live casino,0
52,คาสิโนออนไลน์,คาสิโนออนไลน์,0
53,happyluke,happyluke,0
54,ฟรีเครดิตไม่ต้องฝากเงิ,ฟรีเครดิตไม่ต้องฝากเงิน,0
55,ฟรีเครดิต-300บาทไม่ต้องฝา,ฟรีเครดิต 300บาทไม่ต้องฝากเงิน,0
56,บาคาร่าฟรี,บาคาร่าฟรี,0
57,คาสิโนออนไลน์ฟรีเครดิต,คาสิโนออนไลน์ฟรีเครดิต,0
58,สล็อตออนไลน์ฟรีเครดิต,สล็อตออนไลน์ฟรีเครดิต,0
59,empire777,empire777,0
60,668dg,668dg,0
61,บาคาร่า,บาคาร่า,0
62,ไฮโล,ไฮโล,0
63,รูเล็ตออนไลน์,รูเล็ตออนไลน์,0
64,casino-online,casino online,0
65,โป๊กเกอร์ออนไลน์,โป๊กเกอร์ออนไลน์,0
66,ข้อควรรู้ก่อนจะเริ่มเล,ข้อควรรู้ก่อนจะเริ่มเล่นโป๊กเกอร์ออนไลน์,0
67,เว็ปไซต์โป๊กเกอร์ออนไล,เว็ปไซต์โป๊กเกอร์ออนไลน์ที่เราแนะนำ,0
68,โบนัสคาสิโนออนไลน์,โบนัสคาสิโนออนไลน์,0
69,อัพเดทโบนัสคาสิโนออนไล,อัพเดทโบนัสคาสิโนออนไลน์ ล่าสุด,0
70,เกณฑ์การเลือกรับโบนัสค,เกณฑ์การเลือกรับโบนัสคาสิโนออนไลน์,0
71,โบนัสคาสิโน,โบนัสคาสิโน,0
72,โบนัสเติมเงิน,โบนัสเติมเงิน,0
73,อัพเดทโบนัสฝากเงิน,อัพเดทโบนัสฝากเงิน,0
74,livecasinohouse,LiveCasinoHouse,0
75,โบนัสต้อนรับ-welcome-bonus,โบนัสต้อนรับ (Welcome Bonus),0
76,โบนัสต้อนรับ,โบนัสต้อนรับ,0
77,โบนัสเครดิตฟรีไม่ต้องฝ,โบนัสเครดิตฟรีไม่ต้องฝาก,0
78,ไม่ต้องแชร์,ไม่ต้องแชร์,0
79,อัพเดต,อัพเดต,0
80,แค่สมัครก็รับเลย,แค่สมัครก็รับเลย,0
81,คาสิโนออนไลน์รีวิว,คาสิโนออนไลน์รีวิว,0
82,คาสิโนออนไลน์รีวิว,คาสิโนออนไลน์รีวิว,0
83,อธิบายสรุปการเดิมพันไฮ,อธิบายสรุปการเดิมพันไฮโล คาสิโนออนไลน์,0
84,ทางเข้าคาสิโนออนไลน์,ทางเข้าคาสิโนออนไลน์,0
85,บริการลูกค้า,บริการลูกค้า,0
86,โบนัส,โบนัส,0
87,และโปรโมชั่นที่จัดให้ล,และโปรโมชั่นที่จัดให้ลูกค้า,0
88,ชื่อเสียง,ชื่อเสียง,0
89,จุดเด่นสล็อตที่คาสิโนอ,จุดเด่นสล็อตที่คาสิโนออนไลน์ คาสิโนออนไลน์ ฟรีสปิน,0
90,คาสิโนทำเงินได้อย่างไร,คาสิโนทำเงินได้อย่างไร คาสิโนออนไลน์,0
91,เล่นเกมตัวเลขอย่างไรให,เล่นเกมตัวเลขอย่างไรให้รวยง่ายขึ้น หวยออนไลน์ คาสิโนออนไลน์ คีโน,0
92,เคล็ดลับในการชนะบาคาร่,เคล็ดลับในการชนะบาคาร่า คาสิโนออนไลน์ บาคาร่าออนไลน์,0
93,บาคาร่าออนไลน์,บาคาร่าออนไลน์,0
94,dafabet-คาสิโนออนไลน์-เว็บพนัน,dafabet คาสิโนออนไลน์ เว็บพนันออนไลน์อันดับหนึ่ง,0
95,เล่นไฮโลออนไลน์ปลอดภัย,เล่นไฮโลออนไลน์ปลอดภัยหรือไม่ คาสิโนออนไลน์,0
96,188bet,188Bet,0
97,888-casino,888 casino,0
98,fun88,Fun88,0
99,ทางเข้า-fun88,ทางเข้า Fun88,0
100,นี้ได้กับเว็บ,นี้ได้กับเว็บ,0
101,ร่วมสนุกได้แล้วอย่ารอช,ร่วมสนุกได้แล้วอย่ารอช้า,0
102,แจกเครดิตฟรี-2019,แจกเครดิตฟรี 2019,0
103,และเว็บ,และเว็บ,0
104,sbobet,SBOBET,0
105,ทางเข้า-sbo,ทางเข้า sbo,0
106,ทางเข้า-sbobet,ทางเข้า sbobet,0
107,ทางเข้าสโบ,ทางเข้าสโบ,0
108,สโบ,สโบ,0
109,สโบเบท,สโบเบท,0
110,แทงบอลฟรี,แทงบอลฟรี,0
111,แทงบอลออนไลน์,แทงบอลออนไลน์,0
112,dewabet-ดีไหม,dewabet ดีไหม?,0
113,dewabet-ไทย,dewabet ไทย,0
114,ทางเข้า-dewabet,ทางเข้า dewabet,0
115,สมัคร-dewabet,สมัคร dewabet,0
116,เครดิตฟรีไม่ต้องฝากเงิ,เครดิตฟรีไม่ต้องฝากเงิน,0
117,แจกเครดิตฟรี-2020,แจกเครดิตฟรี 2020,0
118,dafabet,Dafabet,0
119,poker,poker,0
120,ดาฟาเบท,ดาฟาเบท,0
121,ทางเข้า-dafabet,ทางเข้า dafabet,0
122,ทางเข้า-ดาฟาเบท,ทางเข้า ดาฟาเบท,0
123,สมัคร-dafabet,สมัคร dafabet,0
124,สมัคร-ดาฟาเบท,สมัคร ดาฟาเบท,0
125,สมัครเว็บ-poker,สมัครเว็บ poker,0
126,เครดิตฟรี-300-บาท-dafabet,เครดิตฟรี 300 บาท dafabet,0
127,เล่น-poker,เล่น poker,0
128,เล่นโป๊กเกอร์เว็บไหนดี,เล่นโป๊กเกอร์เว็บไหนดี,0
129,เล่นบาคาร่ารวยง่าย-ๆ-ทำอ,เล่นบาคาร่ารวยง่าย ๆ ทำอย่างไร คาสิโนออนไลน์ บาคาร่าออนไลน์,0
130,เล่นพนันออนไลน์จากเว็บ,เล่นพนันออนไลน์จากเว็บดัง คาสิโนออนไลน์,0
131,fifa55,Fifa55,0
132,fifa55hd,fifa55hd,0
133,fifa555,fifa555,0
134,ทางเข้า-fifa55,ทางเข้า fifa55,0
135,สมัคร-fifa55,สมัคร fifa55,0
136,fifa55-ดีไหม,fifa55 ดีไหม,0
137,ufabet,Ufabet,0
138,ยูฟ่าเบท,ยูฟ่าเบท,0
139,เล่นยูฟ่าเบทมือถือ,เล่นยูฟ่าเบทมือถือ,0
140,สมัครยูฟ่าเบท,สมัครยูฟ่าเบท,0
141,ทางเข้ายูฟ่าเบท,ทางเข้ายูฟ่าเบท,0
142,ufabet1688,UFABET1688,0
143,ufa,UFA,0
144,แทงบอล,แทงบอล,0
145,วิธีเล่นบาคาร่าในคาสิโ,วิธีเล่นบาคาร่าในคาสิโนออนไลน์ พนันออนไลน์ บาคาร่าออนไลน์,0
146,เล่นบาคาร่าด้วยสูตรเดิ,เล่นบาคาร่าด้วยสูตรเดินเงิน คาสิโนออนไลน์ บาคาร่าออนไลน์,0
147,การจัดการกองทุนบาคาร่า,การจัดการกองทุนบาคาร่า คาสิโนออนไลน์,0
148,ยำข่าวกีฬา-1-พฤศจิกายน,ยำข่าวกีฬา 1 พฤศจิกายน,0
149,ข่าวกีฬา,ข่าวกีฬา,0
150,อธิบายการเดิมพันกีฬา-แท,อธิบายการเดิมพันกีฬา แทงบอลออนไลน์ พนันออนไลน์,0
151,แทงบอลแบบแฮนดิแคป-พนันอ,แทงบอลแบบแฮนดิแคป พนันออนไลน์ แทงบอลออนไลน์,0
152,ราคาแฮนคิแคปในการเดิมพ,ราคาแฮนคิแคปในการเดิมพันกีฬา แทงบอลออนไลน์,0
153,ราคาแฮนดิแคปคืออะไร-คาส,ราคาแฮนดิแคปคืออะไร คาสิโนออนไลน์ แทงบอลออนไลน์,0
154,การสอนราคาแฮนดิแคป-แทงบ,การสอนราคาแฮนดิแคป แทงบอลออนไลน์ เดิมพันกีฬา,0
155,เดิมพันกีฬาบาสเกตบอล-คา,เดิมพันกีฬาบาสเกตบอล คาสิโนออนไลน์ เดิมพันกีฬา,0
156,อีเวนท์เกมพนันออนไลน์-ค,อีเวนท์เกมพนันออนไลน์ คาสิโนออนไลน์ พนันออนไลน์,0
157,แทงบอลออนไลน์-เคล็ดลับเ,แทงบอลออนไลน์ เคล็ดลับเดิมพันกีฬายอดฮิต เดิมพันกีฬา,0
158,เล่นบอลราคาเสมอดีอย่าง,เล่นบอลราคาเสมอดีอย่างไร เดิมพันกีฬา แทงบอลออนไลน์,0
159,สิ่งที่ห้ามพลาดเมื่อเด,สิ่งที่ห้ามพลาดเมื่อเดิมพันกีฬา คาสิโนออนไลน์ แทงบอลออนไลน์,0
160,เคล็ดลับการเดิมพันกีฬา,เคล็ดลับการเดิมพันกีฬา คาสิโนออนไลน์ แทงบอลออนไลน์,0
161,การแทงบอลออนไลน์-เดิมพั,การแทงบอลออนไลน์ เดิมพันกีฬา คาสิโนออนไลน์,0
162,แทงบอลออนไลน์-การเล่นพน,แทงบอลออนไลน์ การเล่นพนันฟุตบอล เดิมพันกีฬา,0
163,แทงบอลออนไลน์-เดิมพันกี,แทงบอลออนไลน์ เดิมพันกีฬาให้ประสบความสำเร็จ,0
164,ทักษะการพนันกีฬา-คาสิโน,ทักษะการพนันกีฬา คาสิโนออนไลน์ เดิมพันกีฬา,0
165,แทงบอลออนไลน์-ทักษะการเ,แทงบอลออนไลน์ ทักษะการเดิมพันกีฬา,0
166,เตรียมตัวพนันออนไลน์เล,เตรียมตัวพนันออนไลน์เล่นอย่างไร แทงบอลออนไลน์ เดิมพันกีฬา,0
167,วิธีแทงบอลออนไลน์-เดิมพ,วิธีแทงบอลออนไลน์ เดิมพันกีฬา,0
168,คาสิโนออนไลน์-ป๊อกเด้ง-ข,คาสิโนออนไลน์ ป๊อกเด้ง ข้อเสียของการเล่นบาคาร่า,0
169,คาสิโนออนไลน์-บาคาร่าออ,คาสิโนออนไลน์ บาคาร่าออนไลน์ โอกาสชนะเกมบาคาร่าออนไลน์,0
170,มาติดตามข่าวสาร,มาติดตามข่าวสาร,0
171,วันแข่งขันกีฬาต่างๆ,วันแข่งขันกีฬาต่างๆ,0
172,ที่นี่กับ,ที่นี่กับ,0
173,ยอดฮิตที่เรารวบรวมไว้เ,ยอดฮิตที่เรารวบรวมไว้เพื่อ,0
174,แนะนำเบื้องต้นการเล่นไ,แนะนำเบื้องต้นการเล่นไฮโล คาสิโนออนไลน์ พนันออนไลน์,0
175,comebetna,comebetna,0
176,พนันบนมือถือ,พนันบนมือถือ,0
177,พนันออนไลน์-มือถือ,พนันออนไลน์ มือถือ,0
178,12bet,12Bet,0
179,12bet-เข้าไม่ได้,12bet เข้าไม่ได้,0
180,ทางเข้า-12bet,ทางเข้า 12bet,0
181,รวมลิงค์-12bet,รวมลิงค์ 12bet,0
182,bk8,bk8,0
183,bk8-ไทย,bk8 ไทย,0
184,bk8thai,Bk8thai,0
185,ทางเข้า-bk8thai,ทางเข้า bk8thai,0
186,สมัคร-bk8thai,สมัคร bk8thai,0
187,วิธีเดิมพันบาคาร่า-คาสิ,วิธีเดิมพันบาคาร่า คาสิโนออนไลน์ บาคาร่าออนไลน์,0
188,โลกพนันคาสิโนออนไลน์-เว,โลกพนันคาสิโนออนไลน์ เว็บพนันออนไลน์,0
189,เล่นไฮโลจะชนะคาสิโนได้,เล่นไฮโลจะชนะคาสิโนได้หรือไม่ คาสิโนออนไลน์,0
190,แนวทางการพนันกีฬา-พนันอ,แนวทางการพนันกีฬา พนันออนไลน์,0
191,บาคาร่าออนไลน์-เล่นพนัน,บาคาร่าออนไลน์ เล่นพนันออนไลน์ให้ได้เงินง่าย ๆ คาสิโนออนไลน์,0
192,เคล็ดลับการชนะไฮโลออนไ,เคล็ดลับการชนะไฮโลออนไลน์ พนันออนไลน์ เครดิตฟรี,0
193,แบ่งปันเคล็ดลับเล่นพนั,แบ่งปันเคล็ดลับเล่นพนันออนไลน์ คาสิโนออนไลน์,0
194,วิธีเอาชนะเกมสล็อตออนไ,วิธีเอาชนะเกมสล็อตออนไลน์ คาสิโนออนไลน์ ฟรีสปิน,0
195,แบ่งปันทริคโกงบาคาร่า-ค,แบ่งปันทริคโกงบาคาร่า คาสิโนออนไลน์ เครดิตฟรี,0
196,เริ่มเล่นคาสิโนออนไลน์,เริ่มเล่นคาสิโนออนไลน์ได้อย่างไร พนันออนไลน์,0
197,ตัวคุณเองรู้ดีที่สุด,ตัวคุณเองรู้ดีที่สุด,0
198,สุดยอดเว็บไซต์คาสิโนออ,สุดยอดเว็บไซต์คาสิโนออนไลน์ เดิมพันกีฬา คาสิโนสด สล็อตออนไลน์,0
199,คาสิโนที่ดีต้องเป็นอย่,คาสิโนที่ดีต้องเป็นอย่างไร เครดิตฟรี สล็อตออนไลน์,0
200,ทำไมต้องเล่นพนันออนไลน,ทำไมต้องเล่นพนันออนไลน์ คาสิโนออนไลน์ เครดิตฟรี,0
201,คาสิโนออนไลน์-ผู้เล่นเล,คาสิโนออนไลน์ ผู้เล่นเลือกเว็บคาสิโนออนไลน์เพราะอะไร,0
202,พนันออนไลน์ถูกกฎหมายหร,พนันออนไลน์ถูกกฎหมายหรือไม่ คาสิโนออนไลน์,0
203,โบนัสคาสิโนคืออะไร-เครด,โบนัสคาสิโนคืออะไร เครดิตฟรี ฟรีสปิน สล็อตออนไลน์,0
204,เล่นบาคาร่าออนไลน์ดีอย,เล่นบาคาร่าออนไลน์ดีอย่างไร คาสิโนออนไลน์ ป๊อกเด้ง,0
205,เดิมพันกีฬาคืออะไร-แทงบ,เดิมพันกีฬาคืออะไร แทงบอลออนไลน์ พนันออนไลน์,0
206,วิธีการเล่นคาสิโนออนไล,วิธีการเล่นคาสิโนออนไลน์ พนันออนไลน์,0
207,แนะนำการเลือกเกมเพื่อเ,แนะนำการเลือกเกมเพื่อเล่นพนัน คาสิโนออนไลน์,0
208,การพนันออนไลน์ถูกกฎหมา,การพนันออนไลน์ถูกกฎหมายหรือไม่ คาสิโนออนไลน์ บาคาร่าออนไลน์,0
209,การพนันออนไลน์คืออะไร-ค,การพนันออนไลน์คืออะไร คาสิโนออนไลน์ เครดิตฟรี,0
210,วิธีการเลือกคาสิโนออนไ,วิธีการเลือกคาสิโนออนไลน์ เครดิตฟรี สล็อตออนไลน์,0
211,เครดิตฟรี-200-บาท,เครดิตฟรี 200 บาท,0
212,ทางเข้าคาสิโนออนไลน์,ทางเข้าคาสิโนออนไลน์,0
213,แทงบอลออนไลน์,แทงบอลออนไลน์,0
214,วิเคราะห์เกมก่อนแทงบอล,วิเคราะห์เกมก่อนแทงบอล เดิมพันกีฬา คาสิโนออนไลน์,0
215,entaplay,entaplay,0
216,คาสิโนออนไลน์,คาสิโนออนไลน์,0
217,คาสิโนออนไลน์-สล็อตออนไ,คาสิโนออนไลน์ สล็อตออนไลน์จาก bbin ฟรีสปิน,0
218,บาคาร่าออนไลน์,บาคาร่าออนไลน์,0
219,หาเงินจากบาคาร่าออนไลน,หาเงินจากบาคาร่าออนไลน์ คาสิโนออนไลน์ เครดิตฟรี,0
220,ข่าวฟุตบอล,ข่าวฟุตบอล,0
221,ข่าวฟุตบอล,ข่าวฟุตบอล,0
222,ยูฟ่าประกาศเลื่อน,ยูฟ่าประกาศเลื่อน,0
223,covid-19,Covid-19,0
224,covid-19-ไปแข่งกลางปีหน้า,Covid-19 ไปแข่งกลางปีหน้า,0
225,อัตราต่อรองบอลยูโร-2020,อัตราต่อรองบอลยูโร 2020,0
226,การทำนายผลบอลทั้งหมด-กา,การทำนายผลบอลทั้งหมด การทำนายผลบอลทั้งหมด,0
227,ข่าวฟุตบอล-ข่าวฟุตบอล,ข่าวฟุตบอล ข่าวฟุตบอล,0
228,อัตราต่อรองบอลยูโร-อัตร,อัตราต่อรองบอลยูโร อัตราต่อรองบอลยูโร,0
229,อัตราต่อรองบอลยูโร-2020,อัตราต่อรองบอลยูโร 2020,0
230,การทำนายผลบอลทั้งหมด,การทำนายผลบอลทั้งหมด,0
231,การทำนายผลบอลทั้งหมด,การทำนายผลบอลทั้งหมด,0
232,เช็คทายผลบอลวันนี้กับ,เช็คทายผลบอลวันนี้กับ,0
233,เช็คทายผลบอลวันนี้กับ-2020,เช็คทายผลบอลวันนี้กับ 2020,0
234,ทีเด็ดบอล,ทีเด็ดบอล,0
