term_id,slug,name,term_group
235,ที่เด็ดบอล,ที่เด็ดบอล,0
236,วิเคราะห์บอล,วิเคราะห์บอล,0
237,วิเคราะห์บอล,วิเคราะห์บอล,0
238,โปรแกรมวิเคราะห์บอล,โปรแกรมวิเคราะห์บอล,0
239,รวมโปรแกรมวิเคราะห์บอล,รวมโปรแกรมวิเคราะห์บอล,0
240,โปรแกรมวิเคราะห์บอล,โปรแกรมวิเคราะห์บอล,0
241,รวมโปรแกรมวิเคราะห์บอล,รวมโปรแกรมวิเคราะห์บอล,0
242,สล็อตออนไลน์แจกเครดิตฟ,สล็อตออนไลน์แจกเครดิตฟรี,0
243,สูตรบาคาร่า,สูตรบาคาร่า,0
244,banker-player,Banker Player,0
245,พลาดแล้วจะเสียใจ,พลาดแล้วจะเสียใจ,0
246,ฟรี-2020,ฟรี 2020,0
247,สอนเทคนิค,สอนเทคนิค,0
248,สูตรบาคาร่า,สูตรบาคาร่า,0
249,สูตรโกงบาคาร่า,สูตรโกงบาคาร่า,0
250,อธิบายละเอียด,อธิบายละเอียด,0
251,เผยเทคนิคการนับไพ่,เผยเทคนิคการนับไพ่,0
252,แจก-ตาราง,แจก ตาราง,0
253,ได้เงินจริง-ง่าย-เร็ว-แม,ได้เงินจริง ! ง่าย เร็ว แม่นยำ,0
254,โคโรน่าไวรัส,โคโรน่าไวรัส,0
255,ฟุตบอล,ฟุตบอล,0
256,ยิงปลาออนไลน์,ยิงปลาออนไลน์,0
257,วิธีเล่นเกมยิงปลา,วิธีเล่นเกมยิงปลา,0
258,วิธีเล่นเกมยิงปลา,วิธีเล่นเกมยิงปลา,0
259,องค์ประกอบการเดิมพันฟุ,องค์ประกอบการเดิมพันฟุตบอล เดิมพันกีฬา แทงบอลออนไลน์,0
260,jombet,jombet,0
261,สล็อตออนไลน์-คาสิโนออนไ,สล็อตออนไลน์ คาสิโนออนไลน์ การทำงานของสล็อตออนไลน์ webet,0
262,jombet,jombet,0
263,ฟุตบอล,ฟุตบอล,0
264,เคล็ดลับการชนะบาคาร่า-ค,เคล็ดลับการชนะบาคาร่า คาสิโนออนไลน์,0
265,dafabet,Dafabet,0
266,dafabet-คาสิโน,Dafabet คาสิโน,0
267,dafabet-รีวิวโบนัสคาสิโน-dafabet-เงิน,Dafabet รีวิวโบนัสคาสิโน Dafabet เงินจริง,0
268,1xbet,1xbet,0
269,1xbet-คาสิโนออนไลน์,1xBet คาสิโนออนไลน์,0
270,ข้อดีของ-1xbet-คาสิโนออนไลน์,ข้อดีของ 1xBet คาสิโนออนไลน์,0
271,1xbet-และวิธีทำเงิน,1XBET และวิธีทำเงิน,0
272,รูปแบบบาคาร่ายอดนิยม-คา,รูปแบบบาคาร่ายอดนิยม คาสิโนออนไลน์ บาคาร่าออนไลน์,0
273,แทงบอลออนไลน์-เคล็ดลับท,แทงบอลออนไลน์ เคล็ดลับทำนายผลฟุตบอล เดิมพันกีฬา,0
274,คาสิโนออนไลน์-รูเล็ตออน,คาสิโนออนไลน์ รูเล็ตออนไลน์ ทริคการเล่นเกมส์รูเล็ตออนไลน์,0
275,แบล็คแจ็คออนไลน์-คาสิโน,แบล็คแจ็คออนไลน์ คาสิโนออนไลน์ ทำความเข้าใจการเล่นแบล็คแจ็ค,0
276,live-casino-house,live casino house,0
277,คาสิโนออนไลน์-แบล็คแจ็ค,คาสิโนออนไลน์ แบล็คแจ็คฟรีเกมส์ แบล็คแจ็คออนไลน์,0
278,คาสิโนออนไลน์-การเล่นบา,คาสิโนออนไลน์ การเล่นบาคาร่าออนไลน์ บาคาร่าออนไลน์,0
279,แทงบอลออนไลน์-การแทงสอง,แทงบอลออนไลน์ การแทงสองโอกาส สอนแทงบอลแบบ double chance,0
280,m88,m88,0
281,เว็บไซต์เดิมพัน,เว็บไซต์เดิมพัน,0
282,เดิมพันกีฬา,เดิมพันกีฬา,0
283,m88,m88,0
284,กลุ่ม-บา-คา-ร่า-dafabet,กลุ่ม บา คา ร่า dafabet,0
285,กลุ่ม-บา-คา-ร่า-dafabet,กลุ่ม บา คา ร่า Dafabet,0
286,ข่าวสารคาสิโนออนไลน์-พน,ข่าวสารคาสิโนออนไลน์ พนันออนไลน์,0
287,live-casino-house-เครดิตฟรี,Live Casino House เครดิตฟรี,0
288,สมัคร-รับฟรี-200,สมัคร รับฟรี 200,0
289,happyluke,HappyLuke,0
290,happyluke-คาสิโนสด,HAPPYLUKE คาสิโนสด,0
291,ฟรีเครดิต-300,ฟรีเครดิต 300,0
292,โบนัสไม่ต้องมีเงินฝาก,โบนัสไม่ต้องมีเงินฝาก,0
293,ตารางสูตรบาคาร่า-ที่ดีท,ตารางสูตรบาคาร่า ที่ดีที่สุดในปี,0
294,สูตรบาคาร่า-sa-และ-sexy,สูตรบาคาร่า sa และ sexy,0
295,สูตรบาคาร่า-ฟรี-2020,สูตรบาคาร่า ฟรี 2020,0
296,คู่มือเริ่มต้นเล่นคาสิ,คู่มือเริ่มต้นเล่นคาสิโนออนไลน์ บาคาร่าออนไลน์,0

